{
  "$schema": "http://json-schema.org/draft-07/schema#",
  "$id": "cc-catch-up/state.json",
  "title": "CC Catch-Up state",
  "description": "Phase 0 が読み Phase 7 が書く run 間差分照合用の状態。lastCatchUpVersion/Model で差分範囲とモデル世代変更を判定し、prunedConstraints/preservedConstraints で剪定の run-to-run 追跡を行う。スキーマ変更時は SKILL.md Phase 7 と validate-state.py の対応を確認すること。",
  "type": "object",
  "additionalProperties": false,
  "required": [
    "lastCatchUpVersion",
    "lastCatchUpModel",
    "lastCatchUpDate",
    "lastPruningDate",
    "appliedFeatures",
    "skippedFeatures",
    "prunedConstraints",
    "preservedConstraints"
  ],
  "properties": {
    "lastCatchUpVersion": {
      "description": "前回キャッチアップ時の Claude Code バージョン（差分範囲の起点）",
      "type": "string",
      "pattern": "^[0-9]+\\.[0-9]+\\.[0-9]+$"
    },
    "lastCatchUpModel": {
      "description": "前回キャッチアップ時のモデル family ID。現在モデルと異なれば剪定モードを推奨",
      "type": "string",
      "minLength": 1
    },
    "lastCatchUpDate": {
      "description": "前回キャッチアップ実行日 (YYYY-MM-DD)",
      "type": "string",
      "pattern": "^[0-9]{4}-[0-9]{2}-[0-9]{2}$"
    },
    "lastPruningDate": {
      "description": "前回剪定実行日 (YYYY-MM-DD)。未実行なら null。90 日以上経過で剪定モードを推奨",
      "anyOf": [
        { "type": "null" },
        { "type": "string", "pattern": "^[0-9]{4}-[0-9]{2}-[0-9]{2}$" }
      ]
    },
    "appliedFeatures": {
      "description": "適用済み機能の ID（kebab-case の安定キー）。次回 run の差分判定で NOT IN 照合に使う",
      "type": "array",
      "items": { "type": "string", "minLength": 1 }
    },
    "skippedFeatures": {
      "description": "適用不要と判断しスキップした機能の ID",
      "type": "array",
      "items": { "type": "string", "minLength": 1 }
    },
    "prunedConstraints": {
      "description": "剪定（削除）した制約の追跡レコード",
      "type": "array",
      "items": {
        "type": "object",
        "additionalProperties": false,
        "required": ["id", "category", "reason", "at"],
        "properties": {
          "id": {
            "description": "剪定対象の識別子（例: dev-workflow/rules/no-grep-bash）",
            "type": "string",
            "minLength": 1
          },
          "category": {
            "description": "剪定カテゴリ（pruning-heuristics.md の C-1〜C-5）",
            "type": "string",
            "enum": ["C-1", "C-2", "C-3", "C-4", "C-5"]
          },
          "reason": { "type": "string", "minLength": 1 },
          "at": { "type": "string", "pattern": "^[0-9]{4}-[0-9]{2}-[0-9]{2}$" }
        }
      }
    },
    "preservedConstraints": {
      "description": "永続的に剪定対象外とマークした制約。次回 P.1 スキャンで除外される",
      "type": "array",
      "items": {
        "type": "object",
        "additionalProperties": false,
        "required": ["id", "reason", "at"],
        "properties": {
          "id": { "type": "string", "minLength": 1 },
          "reason": { "type": "string", "minLength": 1 },
          "at": { "type": "string", "pattern": "^[0-9]{4}-[0-9]{2}-[0-9]{2}$" }
        }
      }
    },
    "notes": {
      "description": "運用メモ（任意・自由記述）",
      "type": "string"
    }
  }
}
