{
  "lastCatchUpVersion": "2.1.114",
  "lastCatchUpModel": "claude-opus-4-7",
  "lastCatchUpDate": "2026-04-19",
  "lastPruningDate": null,
  "appliedFeatures": [
    "xhigh-effort-opus-4-7",
    "plugin-errors-stream-json",
    "prompt-caching-env-vars",
    "otel-log-raw-api-bodies",
    "powershell-tool-env-var",
    "builtin-slash-via-skill-tool",
    "subagent-stall-fail",
    "plugin-install-range-conflict"
  ],
  "skippedFeatures": [
    "sandbox-network-denied-domains",
    "tui-fullscreen-mode",
    "ultrareview-builtin",
    "less-permission-prompts-builtin"
  ],
  "prunedConstraints": [],
  "preservedConstraints": [],
  "notes": "v1.3.4 の初回 state は PLUGIN_DATA に置いていたため消失。v1.3.7 で repo 管理に移行（git tracked）。v1.5.0 で剪定モード用フィールド追加（lastCatchUpModel / lastPruningDate / prunedConstraints / preservedConstraints）。"
}
